,idea_backstory_motivation,outcome_numeric,gender
66," I had already been experimenting with affiliate marketing and creating websites for quite a few years before I started Financer.com. I had created 400 websites and trialed different kinds of monetization for them, such as Google ads, and confirmed to myself this was what I wanted to do long-term.  But I didn’t have a real focus because I hadn’t found an idea I was passionate about yet until I created Financer.com. I could see how much value it was giving to people, which was a huge motivation to turn it into something bigger. I had a vision for a global business model with websites in different countries, but it was clear the only way to make all of this happen was to let go of some of my other projects and do what I had never done before: focus.  This turned out to be a huge turning point for the business and I now advise any entrepreneurs out there who are balancing lots of projects but not feeling fulfilled to choose the one they care about most and give it 100%.  ",1,0
67," Prior to joining India’s top-ranked B-school - IIM Ahmedabad where I met my partners and Flexiple’s co-founders - Karthik and Hrishikesh, I had been working for 3 years at HUGE corporations which had thousands of employees across the globe, leading me to have a clearly defined role. However, I was never satisfied with my pace of learning during these three years. While at my first job, I found that the focus was more on just sticking to what has been done since the birth of the company, which led me to look for a switch. At my second job, I figured that learning only hard skills such as data analytics is not as fulfilling as I thought it would be. In this search of learning opportunities, I explored the option of working with Karthik and Hrishikesh for a period of three months. The intention was to learn more about technology and entrepreneurship than what textbooks could teach me. Now, we have been working together on Flexiple for three and a half years now.  During this period, Flexiple has undergone multiple iterations. We started out as an automated platform built for scale which was ultimately not used by anyone. We tried out a pure-play service model and within a couple of weeks landed our first client, which ultimately resulted in us scrapping the platform completely. During this time, we decided to double down our focus on startups who were looking to hire remote full-time freelance talent. Having learned the importance of creating value before looking for a sale, we launched remote.tools which aims to be the platform where remote workers interact with each other. ",1,0
68," Immediately, after my time at JPMorgan, I wasn’t entirely sure what I wanted to do next. But, when I got through the top MBA university in India, I felt that it might give me the time to explore my next steps. But on joining the MBA school, the noise around job placements pushed me towards starting something of my own. So, I used to carry around an idea book noting down different ideas that I felt I would enjoy working on. In the process, I recognized that B2B was the space where I would like to spend my time building a startup. Of the many ideas, I found Flexiple to be the most interesting because: Most other freelance marketplaces catered to the “gig economy” - where quality is not the focus, rather the volume is. Whereas, Flexiple plays in the “talent economy” where quality is at the core of everything we do and I felt there was still a huge opportunity there.Further, I believed that the future would involve more & more people being focused on building individual brands vs. just being a small cog of a larger monolithic company.Also, tech as a functional vertical was continuing to grow massively in size - all startups have tech as their backbone. Top this with the fact that hiring in tech is just brutally painful. So, we recognized a real problem - building a high-quality tech talent network that can help startups & companies in hiring. The question was largely about whether we could execute and make things happen. ",1,0
69," Before founding Flexy Global, I co-founded a cross-platform photo editor which was available on the web, Android, and iOS. I was the CEO of a diverse 20+ team and enjoyed taking care of the product.  As a product owner, I was constantly searching for creative, ambitious designers and design agencies. What I understood during these five years as an entrepreneur, is that finding a good UI/UX designer or agency is just pure luck. In 2020, our company exited as we sold our photo editor and we decided to start our digital design agency. Finding a UI/UX design agency or freelancer that is talented, can design a great user-friendly product, is responsible, and time-sensitive is practically an insurmountable task. Most of the top agencies have a 6-figure price tag that not many companies and startups can afford. But, we believe that the world can be a better place with more user-friendly products that help people make better decisions for themselves and society. That is why we came up with the name Flexy. We provide each client with a flexible approach to the design, support, and imprint a part of our company’s spark, our ‘DNA,’ onto their product. It is so rewarding to see a client amazed when they discover the cool design concept we prepared for them.  Besides the cross-platform photo editor, I also co-founded the first-ever deep fake mobile app on the market. I had to shut that project down because working on two products at once was rather exhausting at the time. Aside from that, we were having a very long review cycle for the app updates as we couldn’t make improvements fast enough and that is why we decided to focus on one product. What were the lessons I learned by that time? Well, people tend to look for an option B to succeed, but that is defocusing you from the need to put ‘all the eggs into one basket’ to flourish. If you have enough money and human resources then it is not a problem but, if you need to allocate your time on two different initiatives, you can't succeed against competitors who devote themselves full-time. ‍",1,0
70," The main idea is quite old and evolved out of discussions with friends at university. The main pain point we had at that time was that Facebook just entered the German market and we experienced firsthand what it means to have all your messages and friends stuck in the data silo of studiVZ, which was the German copycat that was used before Facebook. The basis of all product iterations was always that we tried to build something that lets you own your data but still take part in mainstream social media with normal non-nerdy friends. First prototypes were before diaspora but similar federated social networks. We quickly learned that support for all data types (images, events etc.) was too much, so we focused on the most important one: messages. The second learning that led to the product idea was that replacing the status quo was impossible so we focused on building a professional messaging product that used existing messaging channels like Facebook and email. ‍",0,0
71," We had the idea while we were in high school. We were making lists of problems we thought would be interesting to solve. The advice we had heard was to find a problem you have yourself, and then figure out how to solve that. We were sitting in English class one day and our teacher mentioned that somebody needed to make it easier to automatically format papers. We had a little bit of money and we learned about Upwork and Fiverr. Building a website couldn't be that hard. We hired someone to do that. It was 2013 and we spent the next five years building different versions of that website, learning how to write code, learning how to design, learning how to hire people only to find out at the end that you have to have an idea that you can relate to and that you can solve well, but also has to be able to make money. It was incredibly valuable, and I have no regrets. We had a blast. ‍",0,0
72," I hail from a lower-middle-class family in a small town but I have always been a curious and aspirational person since my childhood. In our society, if you are an above-average student you either go for engineering or medical for your undergraduate studies. I chose engineering as I liked maths and went on to prepare for JEE (Entrance examination for getting into prestigious engineering colleges IITs). After failing once and in my final attempt, I got into IIT Delhi (top 3 engineering college of India). College was a lot of fun, I got to explore my identity after seeing people from diverse backgrounds. Also, I got to learn about entrepreneurship for the first time while doing my first internship for a startup that was operating from the dorm room of my college in 2013. After that, I tried to start my own company and after trying multiple ideas, when nothing evolved into something tangible and with a lot of pressure from family, I was forced to take up a supply chain consulting job through campus placements.  Even after joining the job, I used to try to be updated on what was happening in the startup ecosystem and tried to brainstorm ideas on weekends. A few months later, I was exposed to the conditions of the Indian farmers when I saw hunger strikes and farmer rallies happening all over the country. Looking at this, I realized that it was the inefficiency and unfair practices involved in this sector that lead to low farmer incomes. I started researching this field with the idea of connecting farmers directly to markets. After a few months of working part-time on this project, I finally decided to take this up full-time by quitting my job. The initial idea was called FarmConnect and consisted on connecting farmers to markets. I was working on this with a high school student who was passionate about entrepreneurship too. But later on, it didn’t work out and I was left with no job and no co-founder.  But I kept working on the idea and started talking to people in my network who were working on solving similar problems. One of my seniors from IIT Delhi connected me to Amit Kashyap, who was also my senior at college. After graduating from IIT Delhi in Electrical Engineering, Amit started his career with Honeywell Aerospace as a Senior Engineer in 2015. As he worked on system engineering techniques for Aircraft Maintenance IT Solutions, Amit always wanted to work for society and create an impact. This led him to the conditions of Indian Agricultural Producers and he grew passionate about this cause. On gaining a fair understanding of the inefficiency in this sector, he started working on bringing markets closer to the producers. Around the same time I got in touch with him and after a few discussions and debates in the initial stage, I and Amit decided to go ahead with the idea of FreshConnect. Prior to FreshConnect, while in college, there was an important moment in my entrepreneurship journey. In my second year, a guy with a diary in his hand knocked on my door. He explained to me that he had a business opportunity that didn't require investing a lot of money or resources. It was a multilevel marketing business, where you earned passive income by growing your network just like the Amway model. In my desperation to do something, I thought this was a sign and I took the opportunity by spending INR15000 of my college scholarship on that. This guy later convinced me to spend INR25000 more, so as to be able to get success faster. It was all logical for me at that point, so I did invest all my scholarship amount of that semester. Unlike other MLM companies, they were giving products worth the same amount I was investing, but the problem is that no one needed them. On top of that, I flunked my studies to completely focus on my business and justified it by looking at examples like Bill Gates who dropped out of college to start their business. I performed very poorly that semester, lost my scholarship money and soured a lot of relationships with my friends by selling this opportunity to them. This also hurt my mental health as I went into mild depression (without knowing it). I was ashamed of myself because of this failure and I didn’t tell my parents about this until everything fell apart.  But this experience taught me a lot of life lessons:  It's not worth fulfilling your ambitions at the cost of precious relationships. That I am good at sales. I did great in selling memberships as the first time selling something. I used to show them the big picture after trying to understand their motivations in life then. I should not put all the eggs in one basket especially in the case of startups which are very risky endeavors. There should be a fine balance of emotion & rationalism while making these decisions.",0,0
73," I started thinking about the idea behind Friday in 2013. At the time, I had just left a company because I didn’t have a great relationship with my manager. I was struggling at work, but didn’t feel comfortable bringing this up because he didn’t ask, “how are things going?” The best managers I had in the past had regular 1-1s and would ask questions on a regular basis. After this experience, I thought there was a way one could build software to help managers improve the communication and feedback loop between employees/leaders. Unlike a busy manager, a computer would never forget to ask questions as long as it was programmed correctly. I sat on the idea for a couple of years, pitching the idea to friends and executives. People seemed to like the idea, but I didn’t have a working product at the time so I wasn’t able to determine if this was a good/bad idea. Finally, in late 2015 I decided that it was time to stop thinking about the idea and time to start building something. I guess they call this making the transition from a wantrepreneur to an entrepreneur :) Over time, the idea has adapted. I tried selling the product as a “manager sidekiq” and experienced some success with it (growing to $10k/mo as a side project), but I constantly felt like I was missing out on something much better. Around this time last year, I was reflecting on a variety of data points from customers, advisors, and my own personal experience and came to the conclusion that we could create a customizable tool to run any regular communication event/update at work. Instead of being a tool to improve the employee <-> manager relationship, this could be a tool to help you create communication habits at work. Things clicked for me and I became excited about the idea. At the time, this was still a night/weekend project for me, but I knew that I needed to make the jump and go full-time on this. The way I look at the market is that there’s plenty of tools that improve the efficiency of workplace communication. Slack makes it easy to chat with coworkers. Zoom makes it easier to have video calls. But there’s a need to help you create a better communication process. It’s not enough to have the tools. You need to think about your process as well. It’s like having plumbing in your house, but not having pumps to regulate the flow of water. This pivot was risky, but I’m so glad we did it. The best part is that we were able to bring over many existing customers to this new product and they are using the product more than they have in the past. That feels really good. It validates our shift in direction.",1,0
74," My background is actually in sports, exercise, and nutrition! I played a lot of sports growing up—basketball in particular. When I went to university, I studied Sport & Exercise Science. After uni, I set up a personal training business in my hometown of Cambridge. I enjoyed running my own business, but personal training wasn’t the right career for me. I enjoyed staying active and eating well, but I realized it wasn’t my passion. I still enjoyed a beer and a pizza a bit too often! As soon as I had that realization, I knew I needed to find a new path. But all the ideas I was having were for online businesses. I didn’t have the money to spend on getting someone else to build something, so I decided to self-teach. Back then, Lynda.com was the big platform, so I got stuck in learning Ruby on Rails over there. Very early on, I was watching a YouTube video when I came across a company called General Assembly. They had a 3-month full-time bootcamp based in London where you learn the fundamentals of web development with the view of becoming a professional developer. After completing the course, I got a job as a front-end developer. After a year or so of being a professional, I came back to GA on a part-time basis (evenings and weekends). I started as a teaching assistant on top of my full-time job. I hadn’t written a line of code until I was 28 years old, so I had a sense that there was some serious ground to make up. Teaching others was a strategy I knew would help move me forward faster while also getting myself back into the GA community, meeting others, and building my confidence as a developer. Another year on, and I felt ready to start teaching the courses and workshops I had been an assistant for. GA was happy for me to move up to become a part-time lead instructor, and so I started teaching the courses myself! It was through this teaching experience that the idea for Frontend Mentor came to me. At this point, I had been trying (and failing miserably) to launch a new fitness-related online business. I had been building an app for over half a year and still hadn’t launched anything, validated the idea, or even figured out a route to market. Out of frustration, I challenged myself to ship an unrelated idea in a couple of days.  The first idea that popped into my head was a front-end resource list for my students! Not original, I know, but it was something that was needed. I constantly shared the same front-end resources with my students, but I had no central resource to point them to. So I decided to create it. “Frontend Mentor” seemed like a good name, plus the .io domain was available, the person who owned the .com wasn’t using it, and the social handles were all available. So I got to work! After a couple of days, I had created my resource list and shared it with my network on LinkedIn, my students in General Assembly’s Slack channel, and the various (brand new) Frontend Mentor social channels. I received a bunch of positive feedback and thank you notes, which gave me a massive boost! It also made me think more about creating stuff for developers. After thinking more about typical problems my students had, I came up with another idea. A common question my students had when completing our Front-end Web Development 10-week part-time course was, “Where can I go to practice building projects and build up a portfolio?”. My first piece of advice was to build their projects and build sites for friends. However, they would come back by saying something along the lines of “But I’m no good at design. Anything I make looks amateurish. Where can I go to get designs?”. My second recommendation was to go to Dribbble, find a design, and build it in code. But many students would come back and say it was hard to find designs to work to, and once they did, the assets weren’t included, so it was hard to recreate the designs. When I was thinking about other difficulties for my students, my mind jumped to this problem. Why didn’t a website exist that provides developers with professional designs complete with starter code and optimized assets? That would remove so much friction and allow developers to focus on writing code with the additional benefit of creating beautiful-looking projects that would look great in any portfolio. So this is how Frontend Mentor was born!",1,0
75," I remember when I was 8 and I got my first computer that’s when I fell in love with technology. From games to hardware to software and everything in between. When I was 13 I started practicing coding and after a couple years graphic design. Before I turned 18 I launched a web design company with an older friend of mine and pitched our services to businesses while “having a website” was trending in Greece at that time. As soon as I graduated from an American high school in Athens Greece I went to study Shipping and Finance at BCA a London Metropolitan backed University in Athens. I got my BSc served 12 months in the Greek Navy which is mandatory and at the same time, I was working on a couple different blogs that I had with Cassie Ousta, my partner. As soon as I got my BSc I went to work for a shipping company for less than a year which is when I realized that I had to do something creative and something related to tech so I rented an office right across the shipping company that I was working part-time and launched a Media agency with my best friend Mike Chliounakis. We were focusing on Digital Advertising, Graphic and Web Design, Branding, etc. and at the same time, we were running the 2 blogs that I was working on with my partner Cassie. That’s when we came up with the idea of Gadget Flow on August 15th, 2012. We were struggling to find high-quality products online without having to read 1,000-word reviews or scrolling for hours on Amazon and we wanted to create a product discovery platform in which we’d surface great products every day! As soon as we launched Gadget Flow it took off organically. Therefore, I had to quit my part-time job in shipping and close the media agency in order to focus 100% on Gadget Flow.",1,0
76," A few years ago I was getting more and more interested in affiliate marketing. While I was running various online magazines at that time, I didn’t have much experience with affiliate sites. However, one day I stumbled upon a gaming site which was promoting several online games. I liked the idea and did some research. I noticed that various affiliate programs were paying good commission just for leads where users would sign up to play an online game for free (the companies were monetizing the games by selling in-game items or other goodies). I thought if I would be able to scale my own gaming site to a reasonable amount of traffic, then this could pay off very well. At least that’s what I thought. ‍",0,0
77," I come from an entrepreneurial family -- my mother and father have been running a metal fabrication business for more than 30 years. Ever since my teenage years, I’ve been running with different business ideas. In the eBay glory days of the early 2000s, I would try and fund my social life by buying and selling whatever I could get my hands on -- from bread baskets, to cameras and concert tickets. I ended up getting my father’s company eBay account banned… who knew that reselling concert tickets was against TOS!?  After a stint working for an artificial intelligence company in Paris (VirtuOz - acquired by Nuance), I spent 4 years at Google where I tried a couple of other ventures, including a Google Adwords PPC agency and one my mother was most proud of -- a monthly condom subscription company! Neither really got off the ground. While Google was an incredible learning experience, I was always getting itchy feet and found myself looking for something that could better cater to my entrepreneurial mind. Through some networking, I found the co-founders of a small mobile advertising company called Vungle -- fellow Brits, they had just moved to San Francisco for an incubator called AngelPad. They were pre-launch and pre-revenue, with a tiny team -- I took a gamble on joining them and hastily moved to San Francisco from London in 2012. Vungle (later acquired by Blackstone) gave me the incredible opportunity to build a hugely successful global company from scratch, leading an organization across 5 global locations and witnessing ‘rocketship’ type growth that doesn’t come around often. As exciting as it was to play a leadership role, I always had the desire to do it as CEO -- so after close to 4 years I left Vungle, moved to Seattle with my wife and started GawkBox with an old Vungle colleague shortly after. The idea for GawkBox came out of our vast experience in the mobile advertising market from Vungle. We had a lot of relationships in that space which allowed us to identify a pain point -- back at the start of 2016 that pain point was working with influencers to scale user acquisition. We envisaged building a new type of mobile ad network but focused on influencers.  ",0,0
