,idea_backstory_motivation,outcome_numeric,gender
201," Before investing time into Scraper API, I co-founded Fishbole (I am currently still the CTO there too) which is a flipped classroom cloud app for students and educators. It’s exciting because I’ve gotten to manage and coach the engineering team, design the technology stack, and always work closely with the other co-founders to ensure that our mission to build a flipped classroom app with an intuitive layout is realized. Before Fishbole, I worked for multinational companies such as LogMeIn, Dynata, and T-Systems as a manager, leading engineering and product teams. My team and I saw the potential that Scraper API has to do for web developers what Mailchimp does for email marketers, and that’s to streamline a process that can help them succeed in their industry.  ‍",1,0
202," I think we can say that the whole ScrapingBee story actually began almost 3 years ago when Kevin and I decided to build this one fun side project together. I've known Kevin for the last 15 years as we were in the same high school and later in the same university. Early on he introduced me to the whole Startup and Indie Hacking ecosystem by showing me the website and books he loved. This piqued my interest and Kevin and I constantly talked about startup ideas we had. The thing was, we were only talking about or coding some small stuff here and there but we never really launched something. But three years ago, my girlfriend gave me an idea that I found interesting: a product that would allow you to save all the products you are interested in buying online in one place and get a notification once they are on sale. I really loved the idea, as always, I talked about this idea to Kevin and we decide to build it and this time we would not make the same mistakes we made with our previous and unfinished projects: We decided this time to use a boilerplate code so we did not have to deal with code login, email validation, user management, from scratch.We only implemented 2 important features: save the product from everywhere on the web with a Chrome extension and receive a notification once price drops.Even if the results are not perfect, launch anyway. At that time, I was working full time in Paris and Kevin was writing his book about Java web scraping. We built ShopToList in about 1 month, mainly during the weekend and decided to simply post it on three different subreddits and it blew off. I remember that this is 'r/frugalmalefashion', a subreddit dedicated to male fashion discount, that loved our ideas the best, we quickly reached 1000 upvotes and in about 4 hours we had almost 600 users. We were ecstatic, for the first time, we had built something people liked, but more importantly, something people used!  The next week was all about r/posting and some content marketing. We also did a ProductHunt launch that went well, especially considering the state of the app. Quickly we realized that while this app was probably a good idea, making a living out of it would be very difficult, and making a living out of our project was always the goal for us. It would be hard for mainly three reasons: The product needed to be free, so monetization would come from affiliation or ads and both solutions need a huge user base to be profitable. We estimated that we needed at least 100 active users to reach that point with ShopToList.ShopToList is a B2C app and customers are really used to incredibly well-polished app, and ShopToList was not. We knew that in order to build a successful app we would also need to build a mobile app and add many social features.The acquisition is really expensive and hard, especially in the free app B2C market where your marginal revenue per new user is almost 0.Many ShopToList clones existed or used to exist, and it really seemed that only a few of them were making money.   Three months after launch, we decided to put ShopToList on hold. Even if it was not a million-dollar project we considered it a success because it showed us that Kevin and I were both capable of working together and it gave us the confidence to build other products and projects and showing them to the world. Fast forward a few months, out of curiosity we look at ShopToList production database to understand our users. We wanted to know, on average, how many products people added, what was the most famous website... We quickly discovered that out of 3000 users, almost a dozen of them had added around 1000 products each! This was huge, especially considering the fact that we did not offer a way to 'bulk' add products in your account. We went into ""FBI mode"" and understood that those users were actually e-commerce owners who were monitoring their competitor's pricing. EUREKA we though with Kevin, why not build a price monitoring system? This idea seemed really good on paper for many reasons: It is way easier to make money with B2B than B2C.Many price monitoring tools existed, which means that there are consumers for it.Those tools were all very very complicated to use.We could leverage ShopToList users to find our first clients. We did things the usual way, we started with building a landing page, shared it on a dozen Facebook groups. We built an MVP in about 2 months and thanks to a successful PH launch we quickly managed to have 150 users for our free beta. In January, we decided to go out of beta and basically forced our customers to pay for the product if they still wanted to use it. I still perfectly remember that 10 minutes after sending this email, we had our first paying customers. Needless to say, things were looking great. The next following month we would try to get as many users as possible by testing different marketing strategies, mainly content marketing. Our main problem was conversion, it was very very low, approximately 1% (trial -> customer). From day one we knew marketing would be the key and that getting users to our website would be very challenging. But I think one of our mistakes was to overlook how hard it can be to transform a user into customers. We've tried many things to increase the conversion rate, we've rebuilt our onboarding, wrote tons of content, had many many calls and it was just not working. We saw three big reasons for that: We failed to explain the value of price monitoring. We did not know eCommerce very well and I think that this lack of knowledge played a key part in our failure explaining PricingBot value to our users.Onboarding was long and tedious as users had to match their products with their competitors. We offered to do it for a fee but no-one was ready to pay for this, see 1).We never knew who was our target. We never managed to understand what kind of e-commerce needed our tool: Was it a small e-commerce website? Was it drop shippers? Was it a niche website or not? We failed in finding our market. So basically it all came down to our lack of knowledge about e-commerce and e-merchant. In June, we saw that PricingBot would never have the success we hoped it had and we decided to launch something else. And now I’ll finally talk about ScrapingBee. Kevin and I are tech guys, we like to code and to build things. The common denominator of all our previous company work and side projects was web-scraping. We did a lot of it and saw many pain-points that needed to be addressed. Because we used to pay for one and that we were not happy with the product we decided to build an API that would handle headless browser, proxy, and CAPTCHAs for you. We thought it was a good idea because: Web scraping is a really competitive market, if you have doubts about it just type ""web scraping"" in Google and count the number of ads. It was a good sign because it meant there was a lot of demand for it.This time we knew who our customers would be and how to reach them.Because we knew a lot in scraping we had a lot to tell about it and we felt confident in our ability to explain the value of our product to our potential customers.",1,0
203," Before Scream Pretty, I was, and still am, running a successful Jewellery business, Lily Charmed - but the focus of Lily Charmed was on sentimental, gifting charm jewellery and I wanted to flex my designer muscles (Along with my sister Jessica on the left of the photo below), and work on edgier more fashion-led design. This was the inspiration behind Scream Pretty. Before starting in e-commerce, I was a TV and Event Producer - which is a great job - you discover, that with research and hard graft you can become an ‘expert’ in almost anything. I had already tried to start a business. pitching TV show ideas to big Channels in my twenties - turns out they all had ideas ‘just like mine’ in development already! (exhausting) so I decided this wasn’t a business model to continue with. As I’d already tried running a business, setting up another when I had two very small children seemed like a great idea, I could work from home and look after them too. I had a business partner who was already running jewellery shops, so had contacts and knowledge, so starting an online jewellery business seemed an easy step - even though I had NO experience selling online. Sadly, after working for free for two years building and creating a profitable business, Lily Charmed, my business partner decided that he wanted out, and asked for a vast sum of money for me to ‘buy him out’ or split the business (we had created 2 brand names by that point) as I couldn't afford to buy him out - we had to split the business, and I felt very bruised by the whole event. With hindsight though, this backward step, as I saw it then, was the launch-pad to grow Lily Charmed in ways that my previous partner wouldn't (we are now in the largest UK jewellery chain, and exporting to China), and it gave the scope, finances and creative space to launch a brand-new site Scream Pretty. ‍",1,1
204," Since we had to create websites for our businesses and as young professionals didn’t have enough money to cover all the expenses for high-quality services, I studied and handled web design and SEO on my own. It was 2006 and it was a lot easier than nowadays. Later, I founded a SEO agency as a side business venture and was sold in 2015. Believe it or not, from the very beginning of our collaboration with Evgeny we always stashed two or three ideas we could turn into services. Working on a task, we see where and how to optimize or automate a process or how to use knowledge or data we own. With Seomator, I was working on my customers’ websites’ SEO and was wondering how to place SEO Analysis basis rails. As a result, Eugene and I thought why not start a tool that would check and show site owners all the weaknesses of and ways to improve their websites. There are two popular types of SEO Audit Tools on the market right now: SEO Graders such as Woorank, Nibbler, and Mysiteauditor that give you some basic “insides” based on one crawled URL (homepage usually) and SEO Crawlers like Screaming Frog, Deepcrawl, Onpage, and Botify that crawl the whole website and provide results, but usually to figure out something from their reports, you have to understand how SEO works and what you’ll need to do to fix issues.  We are somewhere in between full-scale crawlers and SEO graders we crawl up to 1000 pages from the website and then provide a list of SEO Issues backed with crawl data and detailed information and How-to-Fix tips. What makes us different from our competitors is our absolute focus on the automation of the SEO Audit Reports. We are also proud to be more affordable than most of the other services out there. In 2013, I was working on SEO for a couple of my customers and realized I didn't want to do the same job over and over. I wanted some service to do it for me. I investigated existing tools and found that I wanted something different from them. Tools like SEOptimer, ZadroWeb, or MySiteAuditor provide a quick analysis of your website and give you suggestions on how you can take your SEO up another notch. If you’re looking for something a little more in-depth and technical, without breaking the bank, then Seomator is the right tool. We have Embedded SEO Audit Widget to help SEO Agencies with new sales. Also, you might find a useful Monitoring alert tool to track all changes with a particular website. We offer a free trial you can test out, or you can sign up for a one-time report.",1,0
205," Sharkius was a social games company that I started back in 2007. There were a couple of things that motivated me to start it. I had played many video games throughout my teenage years and always wanted to work in the industry. I was just about to finish my Bachelor's in Computer Science and wanted a head-start. I had made games before university from about the age of 14 some had thousands of users, some had none. Making games, seemed a natural thing to continue doing. Around 2007 Facebook was starting to experience huge growth, and they invited developers onto their platform. I saw this as the perfect opportunity for my indie games to reach a bigger audience.    The problems started a few years down the line. I think my most obvious mistake was the lack of realisation that my experience making good games would not translate well to investing into a team that made good games. Some of the guys I worked with were great people and great developers, but unlike other studios, we were not following a tried and tested formula that could be replicated. We stumbled. Having such game studios was better left to experienced investors with deeper pockets. We grew too fast, too quickly. We did not stay lean. Running a team has so much more complexities than a single person project. I made mistakes in people management, hiring too fast, firing too slow. I made mistakes in project management, and on and on! The inexperience showed at many levels. I was young and over-confident to the extent I was no longer on planet earth. Success had launched me far into space when I needed to keep my feet firmly on the ground. While I do think I got better at the job with time, at the same time, something big was happening. Facebook had grown so much and received so much attention that we were now competing with companies funded with $2-$5M in capital. We had some great ideas, but they had the better execution. Facebook took notice and all of a sudden the platform for engagement and growth became more and more closed. Sudden Facebook changes like closing the notifications channel and reducing feed exposure meant that our traffic dropped to a fraction of what it used to be.  ",0,0
206," Before hacking on a wearable idea to solve smartphone addiction, I studied business in college and worked at several early-stage startups. While pitching that idea at a meetup, I crossed paths with a team working on a mindful phone. Andreas Gala and Jorge Selva met through their partners in Chicago in 2014, connecting over life and business and curiosity about having a more balanced relationship with technology. Jorge had switched to a flip phone on business trips to South America and enjoyed the break from all the noise, while Andreas felt corporate burnout pains in testing lots of smartphones as a product manager at Yahoo.  ",0,0
207," I never cared much about my privacy because, like most people, I have nothing to hide. Last year I watched the Edward Snowden movie (that I strongly recommend) and realized that privacy actually matters and its effect is more concrete than I thought. If we don’t take our privacy seriously, we are going to be manipulated by big companies and politicians. And don’t count on the government to protect our privacy - even if you live in Europe. As a heavy Gmail user, I realized that my Gmail has become my online identity. In order to not be tracked, I need to have as many identities as possible and why not a different identity for each website. SimpleLogin is then created as a solution to easily create a different identity. I have started several adventures in the past but never felt enough motivation or the need to focus 100% of my time. But for SimpleLogin, for the first time several conditions were met: 1) This is a product that I use every day 2) The market potential is big (password managers like Dashlane and 1Password have recently raised more than $100M) - more people care about their privacy 3) It’s technically complex - as a developer, I get bored if there’s no tech challenge. I decided then to quit my job at the time to focus on SimpleLogin. This wasn’t an easy decision: I was leading a software team back then, was well paid, and loved the people there. By that time, I was very impressed by some companies who favor transparency and high ethical standards like Basecamp, Sentry, and Baremetrics, and set out to build SimpleLogin based on these principles.",1,0
208," I’ve been an entrepreneur for almost as long as I can remember. My first business was going around the neighborhood selling rocks that I had found. Later it became bicycle shops and now currently technology startups. This inherent entrepreneurial spirit combined with my interest in business software seemed to make a good combination. While all of these businesses eventually failed at some point, I was convinced that Singulution would be the one that made it. In June of 2017, I left my job at Arista Networks and used my stock options and 401k as a runway for my new venture. When I started Singulution I had no idea that it would eventually fail and be absorbed into another startup called E-DealerDirect, where I am currently Chief Technology Officer. I did not know what I didn’t know and I made many mistakes along the way that fate somehow turned into good fortune. ‍",0,0
209," I studied architecture in Valencia but after a year traveling around the world while working as a web designer, I decided that was the lifestyle I wanted. Even if that meant quitting a career as an architect —and disappointing my grandma on the way. Working as a freelancer can be lonely, so I started looking for online communities for entrepreneurs and freelancers in Spanish. I rather pay a fee and have an active community and well managed than be free and suffer spam or too much “noise”. I found none that I felt comfortable on. So I created it. ‍",1,0
210," Before Sisu Academy, I was working in the start up sector in Silicon Valley for a “Unicorn”, a billion dollar valued start up in the Human Resource Information Systems realm of business. I excel in partnership development, strategic thinking and in building infrastructures for communications. That’s code for working well with people and understanding how to lay the foundations for effective communication. I’ve also worked in conservative consulting corporations, law firms and and insurance companies. I’ve had a lot of corporate experience so the comfort and stability of a regular job and income was all I knew.  I always had a nagging feeling that I could do so much more and make some positive social change in the world, I just didn't know how and was scared to do so. It wasn’t until I met my husband, a serial entrepreneur, and fellow do-gooder, that we decided to start this new social good venture.  The idea was inspired by my co-founder, my husband. His mom suffered mental health issues, he had an absent father and was raised by his grandparents primarily. We reimagined a school that would offer support for young kids so they had the care and support they needed to succeed. One day we were at a bar in Humboldt, California and on the back of a napkin we imagined what a new school would look like. It included a place to offer a supportive living environment where kids would build their dreams, their businesses. I thought it was too crazy to work. Then I went to work researching it, building the business plan and then poof we started to gain momentum.  ‍",0,1
211," When I left university at 21, I followed a pretty typical developer path. I started in a junior developer role and worked my way up from there. I was a lead developer and eventually served as a CTO before leaving to go full-time to work on SnapShooter. Towards the end of my time in the corporate world, I led a project that included moving some dedicated servers at Rackspace over to the flexible droplets at DigitalOcean. During this project, I did a deep dive into the DigitalOcean API and discovered that I could back up my projects every day for less than DigitalOcean was charging for weekly backups. This lightbulb moment was the push to start to develop the very first version of SnapShooter. Unlike the large software projects, I had led or developed (or even some of the failed SaaS ideas I started to build and abandoned,) making the first version of SnapShooter took just two weeks from idea to working prototype. Since the initial investment was minimal - mostly just a couple of hours every evening -  it made sense to get a website together and get it out there. There wasn’t much to lose in getting users in there and start getting their feedback. I didn’t do a whole bunch of customer acquisition-type activities at first, but it’s grown from that initial launch. Four years later, it’s been amazing to grow the platform, and it’s gone from just backing up DigitalOcean droplets to offering many types of platform, database, server and application backups, even Ubiquity cloud controllers. We’ve spent the time and effort building a fantastic backup engine that’s the core of all our services. We’re really proud of it.",1,0
212," Before Sofetch, I worked at Anchor (now Spotify) and PicsArt in community building. I was, and still am, a huge beauty service consumer. As a result, I became very close to all my service providers. They felt comfortable speaking to me about finances and the disadvantages and advantages of the industry. That’s how I found about their common challenges and Sofetch’s idea came up. ‍",0,1
213," I never meant to make Software Ideas. I’m a full-time software developer. On the side, I launched CoderNotes.io, a website for developers to take technical notes that can be easily searched. While that product got a lot of interest (including landing as #2 product of the day on Product Hunt), today it sits at around $50 MRR. I learned from that project that building something people think is cool is NOT the same thing as building something people want to pay for. I also learned that the market you choose is incredibly important. You want to be in a market where customers are already spending money. I documented everything that I learned from the experience in this IndieHackers post: 5 Lessons Learned from Launching my first SaaS. After that experience, I decided I wanted to take what I’ve learned and apply it to something new, instead of  trying to pivot CoderNotes.io to be something else. So I started doing market research. It started by looking at job boards. After all, if they can afford to hire employees, they must be doing something right! Eventually I learned that there were paid databases of company information that would be far more efficient than going through job boards, but they cost up to $1,000 per year. At that point, the pieces fell into place. I realized that the research I was doing might be valuable to people, and now I had an incentive to try to sell it (so I could make up the cost of the databases).  So, Software Ideas was never meant to be a product - I was just trying to research some SaaS ideas for myself! ‍",1,0
