,idea_backstory_motivation,outcome_numeric,gender
0," During college, I thought I wanted to be a doctor. But oh man, the pre-med weeder classes were horribly boring and structured in a way where it wasn’t easy to study or learn. I noticed that my fellow classmates felt the same pain, and started looking for a better way. Inspiration hit when my roommates were talking about how they could remember every pokemon from 10 years ago, but couldn’t remember what they studied yesterday. That was the big ‘Aha!’ moment. Growing up I was always a gamer. My family would play hours of Dr. Mario (trash-talking the entire time) every week, and I always had the newest Nintendo game to dump hours into after sports practice. I continued playing games during college and made friends with some kindred spirits. My freshman roommate and co-founder was the best Meta Knight player in NA, so I was constantly surrounded by hardcore gamers and the new hot games. This kind of environment made it easy to tie game mechanics to a better way to learn. The University of Michigan (Go Blue!) has an amazing library. Every book you could ever want. I started devouring everything about games and learning and found that every book I tried to check out was on the syllabus for this EDU 222 class called “Games and Learning” led by Barry Fishman. Ended up enrolling in this class alongside my graduate work (studying Hospital and Molecular Epidemiology). The knowledge gained here helped us build the foundation for a working product and learn exactly why I remember everything about the Pokemon game from my middle school years. During college, I thought I wanted to own and operate my own music venue (being a doctor was my back up plan). To vet the field, I formed, led, and wrote music for a ska band called “Gunday Monday”, named after a joke about arm day at the gym. Ska was perfect music for understanding the music industry. Enough people liked it around Ann Arbor that you could get shows at every venue, but not enough liked it enough to form bands to compete with you for those shows. I ended up opening for every one of my favorite acts and getting to see them for free. I also saw how different types and scales of music venues worked from the inside. This taught me enough to know that I did not want to own my own music venue, although it was a lot of fun. That ska band taught me all about music production which generated all the sound effects and music assets for our game with 101 studios. Still have a few on Bandcamp here if you want a taste. I also learned a ton about management. Trying to get a team of 8 musicians to show up on time, let alone play music somewhat passably, was another good challenge that grew some serious new leadership muscles. This gave me the foundation I needed to build out the art assets while my co-founder coded up the actual game engine. ",0,0
1," Doing stand-up comedy was what led me to create 10er. 7 years ago, I asked my friend and fellow comedian if he wanted to do a podcast with me. Few people listened to podcasts back then, let alone knew what they were. Since then we’ve recorded 262 episodes and have recently ended the project. Along the way, we took donations from our listeners. One-time donations were fine – we were of course stoked that anyone would give us money for something they already got for free. But one-time donations were hard to plan anything around. And we didn’t want to keep pleading for donations. Then Patreon popped up and the model seemed like the perfect solution. Instead of sitting around waiting for donations, the donators subscribed to donate, giving an amount they decided themselves per episode we released. I never created a Patreon account for us though. Everytime I began I never finished signing up. The whole thing just seemed like a hassle. Too many input fields and things to consider and graphics to provide. Patreon expects creators to create more content for patrons. We felt we were already giving away lots with our already free content. So, being a programmer (and perhaps naive), building my own service as a side project seemed like the easier solution. I’d recently made another side project using Stripe for the first time (Motherload.dk – a webshop selling Danish comedy shows as digital downloads) and the experience of using Stripe was such a joy that I kind of felt like I could build anything. I still feel like that. What a wonderful service and company. Highly recommended! I built 10er only for my own podcast but in such a way  that if somebody came along and wanted to use it for their own project then it wouldn’t take too much of an effort. The first month 10er charged money was December 2014 and about half a year later the first other project joined.",1,0
2," Hi, I’m Harry Dry, 23 years old. Well, I’d just left university. I “studied” Economics and to be honest though the whole thing was a complete waste of time. I had no interest in sitting in a suit and bullshitting about Macroeconomics for my next 50 years. So I started learning to code. Began with Code Academy, then I found the Net Ninja, Wes Bos, Level Up Tuts who taught me pretty much everything I know. I’ve always been a big believer in real-world experience. There’s “blog post knowledge” and then there’s “DIY” knowledge. One thing is watching a Wes Bos copying some code and another is getting out there in the real world and doing it yourself.  So that was the reason I started my first business. Real coding. Real experience. Real money. I just needed an idea...   Well, I’d got back from university, arrived back at my parent's house and there were these huge canvases hanging on my bedroom wall. My friend Giles bought them for me as a gift for finishing my degree.  On the canvases were tweets from Roger Federer and David Luiz. Originally it was pretty surreal, “What, has Roger Federer tweeted me!” I realized they were fake when I noticed that Jeremy Corbyn, Theresa May and Donald Trump had liked them. But I still, it was a really thoughtful gift.  I just got really excited by these canvases. So I thought this is it. I’m going to try and build a website which allows you to write up one of these custom tweets and purchase them as canvas prints online. ",0,0
3," My first job was at Jimdo, a website builder company. I did lots of A/B tests there. Even though the concept of an A/B test is simple, it’s not that easy to do it right. And the more tests I evaluated, the more I realized that people neglected documentation of results. In my experience, the results were so valuable because they allowed me to have a knowledge of what worked and what didn’t. For this reason, I built an internal tool to solve this problem and to evaluate tests automatically. My teammates liked this tool, as they stopped needing to evaluate their tests manually. Instead, they just needed to fire a SQL query, and the tool did the rest. Documentation of A/B test resulted in great benefits, too. It was so much easier to argue on what we did, how it worked and what the next steps were. Also, many co-workers found this documentation useful as a source of inspiration for what they could do next. Seeing how successful this tool was at Jimdo, I decided (with the permission of my CEO) to turn it into a stand-alone service, called ABBY.io. It took me almost nine months to launch it. Someday after an exhausting coding session, I decided to pull the trigger in a “f*ck it, ship it” moment. ‍",0,0
4," Addressbin actually still exists, so I guess it's still in the process of failing. It started as an easy way to collect email addresses, mostly (as is my habit) as a way to provide myself a facility to do so for free and then expanded to allow other people. Having collected all those email addresses, it was a short step to allow people to send emails to them, which I implemented by making a special address for each list that would forward your message to each address, and just like that, I invented the Mailing List. I added a few more features (Drip messages, opt-in forms) but ultimately at this point, I was competing with Mailchimp and everyone else and decided to stop working on it. It's still up and running fine and requires very little input on my part. ‍",0,0
5," Being honest, these were the three main reasons why I started. I was born in an Indian middle-class family in a tier-three city (between 20k and 50k habitants). During my childhood, we continuously faced challenges, mostly related to money and resources. I wanted to remove this tag anyhow and wanted access to ample money for my family. So I had two options: joining the civil services or starting a business. My family and relatives still regret that I haven’t tried for civil services.Our college incubator was the second reason. They showed us the way to begin a startup we did it without any pressure, working on Govt subsidy and only paying INR 500 a month ($6.62 USD) for a full office, machines, and broadband. This was an amazing experience for two young boys.The third and the long-term reason is that I love working on solutions. I always feel a sense of responsibility when I observe my thinking patterns. I don’t find a problem as a problem but I think it as an opportunity to build a new solution. Initially, it was money that motivated me. However, to be able to drive a startup in the long term, the motivation behind it must be something else. For me, it was that continuous kick from inside that would make me be high without using any weed. I can talk about startup ideas, plans, world-changing businesses and projects, and all similar stuff, for days. ‍",0,0
6," I was still in college at Indiana University when I started Adproval. Thankfully, one of my majors was Entrepreneurship and I had saved all those courses for my final year so I was able to use my own idea for all the business planning exercises in school.  I became personally interested in “how websites make money” which led to learning about digital advertising / Google Display Ads. Around the same time, a family friend’s lifestyle blog was starting to grow really quickly. I asked her how she was monetizing her site and discovered that given the relative niche of her site and the lack of control of display ad networks, she didn’t have a good system. She was working directly with advertisers from brands she was comfortable endorsing which required a lot of manual work with back and forth negotiating, ad image uploading, analytics tracking, lining up her next advertisers, etc…  From that initial point, my original idea was to be a “Blog Coach” of sorts to help set up monetization streams for bloggers as a consultant. I thankfully had a professor teach me about the limitations of a time-services company and suggested how the scalability of software could help!  Apart from this, I also ran my brother's lawn and landscape company in High School when he left for college. My family history is very entrepreneurial, though, from my great grandfather (who was one of the first inventors of the Travel Trailer / RV) to my dad (who always was tinkering with his own businesses).",0,0
7," Jared: I come from a background in branding and digital marketing, but I’ve always had a passion for making music. Strangely, that’s why this all happened – I was sick of all the confusing, expensive, and unnecessarily complicated warranty plans for all my music gear, plus my phone, my laptop, and so on. I knew there had to be a way to make this better for me as the customer, and when I found out that the product I wanted didn’t exist, I decided to build it. Eric: Out of college, I was originally a jet engine engineer with GE Aviation, but I ended up moving into management consulting and venture capital while attending Harvard Business School. When Jared told me about his concept of bundling device protection this way, I knew immediately that this was the kind of big idea that I was looking to execute and help reach its fullest potential. That’s what we’ve been doing ever since.  Jared: We initially launched direct to consumer, which wasn’t necessarily the best approach for us, but because the product is so compelling, we ended up getting a lot of inbound interest and business partners. That made us realize that organizations all across the country wanted the same thing we did – a single, seamless way to protect the devices of their customers, members, students, or teams.  Eric: That led us to build an entire platform to service B2B and B2B2C opportunities, and at this point, we’re truly a universal platform that sits at the center of our repair-shop partners, underwriting options, customers, and business partners. ‍",1,0
8," In my first job out of college (Bain), I was frustrated by how subjective hiring was. Along with a number of other recent Stanford grads, I was assigned to review Stanford student applications for the entry-level consulting position. I was struck by how differently my peers and I assessed candidates. We were aligned on the outcomes that defined a good hire (high-performance ratings, retention), but we disagreed on the inputs that generated those outcomes. For example, some of us thought a STEM background was critical others thought humanities majors did better. Some thought club leadership was a key input, others thought a high GPA was critical. It occurred to me that we could answer these questions analytically, by mapping our performance/retention records back to job applications and looking for correlations.  I started to dig into this problem in my free time in 2011-2012, and I quickly stumbled on 3 challenges. First, the data wasn’t readily available - it was spread out across homegrown systems that lacked APIs or basic file export capabilities. Second, HR leaders weren’t thinking about data science and their eyes tended to glaze over when I started talking about analytics. Third, I realized that the outcomes data (the “ground truth” represented by performance ratings and retention) could themselves be biased if the organization was biased in the way it treated some hires. So I paused. But I kept watching the HR space and by 2016, I thought the first 2 barriers were eroding. It seemed to me that most enterprises had moved to cloud-based HR systems with API/export capabilities and HR leaders were starting to get excited about data science. In late 2016, I started asking companies if they would share anonymized employee data with us and a few did so. While I was still at Harvard, we confirmed that there really was predictive power in these companies’ job application data that predicted who would perform well and remain in the job. This was a signal these companies weren’t yet using or aware of. With some proof-of-concept in hand, I went full-time on Ansaro as soon as I graduated from Harvard.",0,0
9," I was working in a pharmacy, where I realized how even a small store needed scheduling software for its employees. The way we managed employees and their working hours was very outdated. We used excel sheets and simple pen and paper to manage staff and their shifts. This caused lots of confusion and conflict among the employees.  Before studying pharmacy I already had a passion for software development and was involved in a few projects. So after looking at the current solutions, I saw great potential. They were outdated, had bad UI, were overloaded with complicated functionality. And the barely usable ones were far too expensive. I previously had written a scheduling software just to use it in the pharmacy where I was working. The idea wasn’t to make money off it. So I wrote the scheduling software and a task management tool which they are still using, and some other pharmacies as well. But then I decided to rewrite the application (the scheduling software) for all kinds of businesses. ",1,0
10," AskTina was a live video chat widget for experts to install on their blogs and allow their readers to place live, pay per minute calls to their mobile phones through the AskTina app. We built an MVP, had 35 Experts install it on their blog and with 10,000 page loads of the widget, we had 0 paid calls placed through the software. This was the objective data we needed to make the judgment to kill the project. Ideally, we could have discovered this before we spent 6 months working on AskTina by interviewing the readers of specific blogs. ‍",0,0
11," I met my co-founder on Instagram oddly enough. We were both Amazon sellers but he was a bit further along than I was. We would meet once a week to hold each other accountable to our goals and talk strategy. He had already started developing our first product, which is a CRM tool for wholesale Amazon sellers called Vendrive CRM.  We started working together on the project but quickly realized we had the skillsets to do something larger. That’s when we had the idea of building an intelligent repricing tool that put engineering and data over sales and started working on Aura. We were fortunate enough that our monthly expenses were so low that Vendrive actually provided enough cash flow for us to fund our time developing Aura and getting to our launch day. It was painful but focusing on delayed gratification is a founders secret weapon!  ",1,0
12," Autto.in was an on-demand doorstep car service provider, which operated in the city of Hyderabad, India. Our service consisted of sending mechanics to the doorstep of car owners who required general maintenance services, such as oil change, spark plug change, battery change, among others. As a car owner, I used to find going to the automotive dealer garages very expensive, as my car was out of warranty. And, apart from the big costs, I had some bad experiences with an authorized garage. This motivated me to solve this problem by myself, by asking mechanics to visit me and fix the car in front of me. ‍",0,0
13," Before we met, Roman had been working as a software engineer for global startups for over 8 years.  Stacy worked in marketing and communications. She's built her career from a PR manager of an Olympic champion to a CMO of an E-commerce company selling goods in 100+ countries worldwide.  It might sound funny, but we owe Tinder for our meeting - 5 years ago, its algorithms matched us together. That’s how the Awesomic story began.  After two years of relationships, we started thinking of a common business - we were simply cut out for this. We still laugh, saying that it was a perfect match not only for us but for many people eventually. Our first project was creating different apps for Shopify. We didn't have enough experience and any step-by-step plan, which we quickly realized and quit after releasing two plug-ins.  At that time, we also graduated from the Y-Combinator startup school, which was one of the key milestones in our development. It helped us understand where we'd like to move next and how to work on our mistakes. While carrying out our first project, we found out that a good developer was a rare bird on the Ukrainian market. Using Romans' experience, we decided to launch an online school for developers - Doge Codes. It was going pretty well. In 2 years, we had 200+ graduates and became the first Github representatives in СIS countries. Our concept was ""learning by doing"" - the students were mastering development while creating a real app. Yet, there was one big disadvantage - Doge Codes was a local project. And however happy we were to see our student's progress, we still wanted to work for the international market.  So here is our first insight - if you want to create something global, think on a large scale from day one because later, it might be impossible to make a big chair out of a small piece of wood. One day, we found out that we were almost out of budget, and Roman was even going to find a ""proper"" job if we didn't come up with a new business idea.  At the last moment, it hit us: design subscription - that's what everyone needs.  You know, small businesses and startups like Doge Codes often face the same problem when it comes to design. They don't have enough tasks to hire a full-time designer but still need marketing visuals and website-related graphics. Mostly, they choose to work with freelancers who are sometimes unreliable and don’t live up to the expectations.  We did quick research, didn't find any existing models, and decided to give it a try. And that turned out to be an Awesomic idea.",1,0
14," When I was first raising money for my education company, I had no clue what I was doing. I neither had the network of investors nor knew how to fundraise or build a pitch deck. So, I ended up making many mistakes. Back then, I bought a pitch deck template from a small website. I liked it because of its perfect structure. Later on, I met the website’s founder, and he told me that he wanted to sell the business. After checking some of the numbers, it became evident that I had to buy the company and use my experience to bring it to the next level. And that's what I did. In 2019, I acquired BaseTemplates and grew it from one product to five. Over the years, I  have helped thousands of founders raise money for their idea. ‍",1,0
15," Honestly, my options were a bit thin on the ground. I’d moved to a new town with limited opportunities for my skillset my employer was happy to let me work from home but shortly after that they made me redundant. Realistically, my options in the locality were to take a 30% pay cut or start my own business. And if I was taking a massive pay cut anyway, I wasn’t going to answer to some other bastard! ‍ What's your background? What part of your background defines you, and possibly led to starting Bediwin Information Services? I grew up the son of a self-employed accountant most of my mum’s clients were themselves self-employed. In those days, a small business owner could (with enough sacrifice) put a child through a private school. So many of my friends growing up came from families that had a business of some sort. So, I didn’t perceive it as being particularly risky I just saw it as another way to earn a living. ‍ How did the idea come to you?  I knew my employer needed me occasionally - but the keyword here is “occasionally”. They certainly didn’t need me full-time. In that respect, their decision to make me redundant was absolutely correct. So, I offered to take redundancy and contract back to them on the understanding that I was free to seek other clients when I wasn’t dealing with them. They accepted this offer, became my first (and, for that matter, biggest) client and that gave me a basic income to get started. ‍",0,0
16," We applied to the Techstars accelerator with the concept of “Twilio for Biometrics”. We were going to build an API so any developer could quickly and easily add biometric identification to their software. This was back in 2013 and when we did our customer discovery, we got a lot of blank stares. It was probably way too early. But we did learn that there were huge problems with online fraud that were really identity problems. When you do business with anonymous people, you have no recourse if they turn out to be assholes and we felt like we could address that problem. If you want to defraud someone online, you create an account with a fake identity and use stolen credit cards. Then the real credit card owner discovers they have been a victim of identity theft and the credit card company reverses the charges. The money is taken back out of the online merchant’s account but they have already mailed the merchandise. Online merchants lose a lot of money this way. BeehiveID identified online accounts created for fraudulent use. My technical co-founder has a Ph.D. in Computer Engineering and had an interest in social network analysis. He came up with the concept of using social network analysis on the data available through Facebook in combination with a few other tricks to identify a fraudulent online user. This is how BeehiveID saw the social network graph of a fraudulent online account. This is how BeehiveID saw the social network graph of a real person. So, the idea was that a person would log in to a site using the Facebook OAuth and BeehiveID would comb through the data available through Facebook and let the site know if the account was fake. It’s still a really great idea. (If only a great idea was enough.)",0,1
17," Myself and two partners launched my first company while I was in college. I dropped out shortly after to focus full-time on the business.  What started in 2006 as the dream to create what would become Bildr quickly pivoted into a services business when funding for “no-code” developer tools fell on deaf ears about 15 years ahead of the market. We didn’t let that kill the visual development dream, though. Instead, we served customers using early versions of Bildr to create custom web apps faster and with fewer resources than our competition. As time went on, our customers continued to request more advanced features, so we continued to expand the capabilities of the tools to match that need. A few years ago, as the market caught up to the concept of visual development, we decided to spin Bildr out as a separate product company. So in July of 2020, we took the plunge, formed the newco, and began iterating with early alpha users as we completely reshaped our internal tools as a product suitable for market adoption. We are incredibly excited to be launching out of beta in Q1 alongside a suite of web3 and NFT products driven off of Bildr’s uniquely extensible architecture. ‍",1,0
