,idea_backstory_motivation,outcome_numeric,gender
120," Legaats was a web app where baby boomers and senior citizens could store, categorize, and interactively share all their most important life lessons in video, text, or photo format to pass on to future generations. I was inspired by my own grandfather’s autobiography, where I learned a lot about his life and found lots of wisdom I didn’t get the chance to hear from him directly. I wanted to replicate that sensation everywhere, and I felt that no dominant consumer platform had succeeded in tapping the idea of building your “digital legacy.” I really loved the idea of mentorship & wisdom-sharing, so it made sense to me at the time. I also researched and found that half of the US population would be above the age of 50 by the end of 2017, that this age group controlled 70% of disposable income in the country and that they were suffering from the widespread epidemic of social isolation. Legaats was meant to help alleviate that problem!  ",0,0
121," I grew up in Santa Monica, California with my parents and three younger siblings. From an early age, I’ve found myself in highly competitive environments that can often turn quite stressful. The school I attended through 8th grade, Brentwood, was pretty rigorous, and it was hectic balancing schoolwork with the sports I played. I was fortunate enough to have been surrounded by some great role models—my mom and dad, coaches, and teachers—who encouraged me to take on challenges and responsibility without sacrificing wellness or perspective. Nonetheless, I found it tricky to obtain this balance day in and day out. For high school, I decided to set off on my path to expand my horizons, leaving LA to attend boarding school at Hotchkiss in Lakeville, CT. Looking back on it, it’s wild to think that I made such a major life decision at the age of 14, but I’m glad I opted to push myself. Hotchkiss was very tough academically––despite the talent of the students there, I witnessed a lot of my peers burning themselves out by the end of it. At the time, I was also playing quarterback for the football team working towards college recruitment added its unique pressure on top of everything else, and the combination bordered on overwhelming. When I started college at Columbia University, it had become clear to me that something needed to be done about the stress culture I’d witnessed everywhere I’d gone. Though Brentwood, Hotchkiss, and Columbia are all very different places, I noticed a consistent thread of students engaging in the “work hard, play hard” mantra and eventually buckling under its weight. Don’t get me wrong—I believe it’s very important to stay ambitious and goal-oriented. However, I noticed that oftentimes the partying, drinking, etc that my friends and I thought was “balancing” out our hard work was only decreasing our productivity and leading to more stress over time. To reach my own goals—pursuing my major in Internal Relations and minor in Ancient History, playing on Columbia’s rugby team, and of course, growing Leilo—I realized that my habits had to become more sustainable. That’s why I’m so passionate about our product I use it every day to soothe my anxiety and stay grounded, and I’ve seen it make a similarly positive impact in my community. As I enter my senior year of college, it is clear that Leilo has made a major and necessary difference in my life, allowing me to tackle the challenge of each new day with calmness and confidence. As crazy as it sounds, the eureka moment to create Leilo came the very first time I tried kava in 2018. I was on a random and fortuitous family trip to Fiji, hanging out with some locals I had befriended in a village near Pacific Harbour. We were sitting in a circle in one of their homes, sipping kava, and speaking like old friends even though we had met only a couple of days before. The warmth, generosity, and sincerity of the Fijians, which they largely attributed to the calming, regenerative powers of kava, really stood out to me, especially in comparison to my experiences in the States. I felt extremely lucky to be included in this kava ceremony but simultaneously saddened that I couldn’t share it with everyone back home. I remember sitting at dinner with my family an hour or so after the kava ceremony, the dilemma still gnawing at me. Though it would be hard to top enjoying kava from coconut shells on an idyllic beach in the South Pacific, there had to be some way to share the magical properties of kava, as well as that culture of friendship and optimism, with a greater audience. To everyone at the table’s surprise, including myself, I declared that I would find a way to make an RTD kava product and bring it to market. Though it was a fledgling idea, and though I had no experience in the F&B space whatsoever at the time, they believed in me. A lot of progress has been made since that moment of inception, but I am proud to say that it is those same people, my family, and friends in Fiji, who continue to be my closest advisers and supporters. As Leilo continues to expand, it’s essential to me that my company does not stray from our roots and the hospitality, loyalty, and love that made all of this possible in the first place.",1,0
122," I'm a Chemical Engineer (which has pretty much nothing to do with what I'm doing right now) and I’ve worked for companies like P&G and Hermés. Then I did a Master’s in marketing and this is where I started launching companies. I initially started a t-shirt business that didn't work really well, so I quickly moved on to LeadGuru with some friends. We made a bit of money, but I wasn’t really happy with such an unscalable business. At the same time, I was really intrigued by SaaS business models. I found it super interesting to be paying for different apps like Audible, which increased my curiosity around the software and tech space. Ultimately, I’ve decided to take a chance. With LeadGuru, we were within one of the biggest French incubators called STATION F. The two co-founders I partnered with on that project decided to move on from a company they were working on at the moment and we’ve ended partnering up to build something new. Since then, the idea hasn’t changed much. The differentiation factor was to bring personalization and cold emails together. But, as personalization of text already existed, we took it to the next level and introduced customization of images and landing pages. ‍",1,0
123," The idea was not mine. It was from my co-founder Iñaki Ecenarro. When I was negotiating my way out of Wuaki, I spoke with many people from the Spanish startup ecosystem because I was trying to find out what to do.  After talking with Iñaki at an event, he told me he was thinking about launching a startup in HealthTech or EdTech and I told him that I didn't want to start anything from scratch. I had promised my wife and family that I would join either a large corporation with a good salary or a more mature startup. I had very good opportunities and lots of interviews. But he insisted and we agreed to have a coffee. We met at Starbucks and he showed me a small prototype he had built himself around the concept of kids from 2 to 6 years old, spending too much time with mobile devices and tablets. It was a fact that kids would always end up on YouTube and that parents give their phones and tablets to them as a way of having more free time. The idea was to bring to parents and kids something entertaining, but at the same time a learning experience. We would help them learn the basic stuff that you learn at kindergarten. The kid would be entertained and he would opt-in for that rather than going to YouTube. ‍",0,0
124," I was working for a corporate Telecom company and in Pakistan for two years in B2B Corporate Sales and I saw that I wasn't growing enough. I was a really good sales & marketing person in that company, but I was not getting rewards enough. So, I started disliking my corporate life and the corporate structure. When I came to Germany as well, I started working for a big company that was acquired by Intel. But I soon understood that big companies were not my thing and that I had to join a startup. But rather than start working on my own business, I first wanted to have some experience in the startup industry so I joined a startup in Advertising Tech and that was my first startup experience. It was an incredible experience and I gain a lot of knowledge because I learned a lot about how startups work. My motivation to start Lieferoo was not only to make a lot of money but also to make some impact in the world. I also wanted to solve my personal problem which consisted of bringing things from Pakistan to Germany. I like a lot some unique stuff that is from Pakistan so I used to constantly ask my friends to bring me different things. Every time someone traveled to Pakistan I asked for certain things that couldn’t be found in Germany. But it then started to be quite annoying for me. I wanted to pay for someone who could just bring these things. I thought: “If people are paying other people to transport them, why wouldn’t people pay other people to transport them certain things?”. For example, the tea in Pakistan is very specific and I love it, but in Germany, it was really expensive. I soon also found that there were other people in Mexico and other cultural countries who wanted products from other parts of the world. That’s when I thought that I was solving a big problem. Before Lieferoo I was also studying consumer affairs and technology management at the Technical University of Munich. I wanted to move into only marketing as in Pakistan everything was marketed through traditional channels It’s great to emphasize that before Lieferoo, I also failed to build one business in a coaching center but we did not invest much time in it. ) This occurred when I was in University. I was really good in college at College Admissions, so I wanted to start a college admission test business so as to help people get into my University. It completely failed. The business idea was quite simple: we gave a free test version so that people could come to do it and receive the results and find if they were good enough for the college. If the results were low, they would come to a series of classes where we would teach them how to do the test properly. The failure reason was our location. We did these tests and classes in a small house located horribly where nobody could see it. Also, my target market wasn’t prepared to pay for the classes – they just wanted to see if they could pass the test (the majority didn’t).",0,0
125,"  I have known I wanted to be an inventor since I was eight years old. That is the year that my parents took me to visit Thomas Edison’s original laboratory in New Jersey. A laboratory assistant who worked with Edison directly chose me to demonstrate how a piece of equipment on display operated.  I had my heart set on being an inventor from that point forward, but my dad told me that inventor jobs no longer existed. Undeterred, I developed more than 100 patents over the next 50 years. My dad later apologized, and we get a good laugh out of it to this day. However, I hope this serves as a lesson to anyone who does not initially feel supported in pursuing their dreams. People often ask me how I came up with the idea for LifeWave. I worked at a company called AAG in 1999 as part of a team that developed survival equipment for the United States Navy. The naval crew in charge of a mini-submarine had to remain awake for 30 consecutive hours, and I wanted to find a solution that did not involve using stimulants, drugs, or caffeine. I did research for three years before I launched LifeWave. It was a big moment for me because I believed so strongly in the ability to naturally stimulate the body’s metabolism without resorting to artificial means. ",1,0
126," Before Linkody, I launched a previous startup with a friend of mine. However, this wasn’t a success and we soon gave up (this could be a story in the failed section ). I did learn my first lesson then. Don’t start a business with your friends just because they are your friends. By working on that first business, I eventually got the idea for Linkody. Back in the days, the only thing I knew about SEO was the importance of backlinks. I was doing link exchanges and needed a tool to check that my partners didn’t remove them. A lot of the existing tools were providing general reports about new and lost links, but none was offering to manually add links and check them on a daily basis. I thought it was worth investing some time in this idea so I decided to develop a minimal viable product. ‍",1,0
127," When I was 15, me and 2 of my high school buddies started a game hosting company. We were kids and we were selling virtual server space for games like Counter Strike or World of Warcraft to other kids. We failed and discontinued the project when we all went our separate ways to different universities. During my studies, I started a new eCommerce project, an online pharmacy with automated delivery of commonly used products like toothbrush, razors, toilet paper etc. Even though I made it to the final of the Student Entrepreneur Awards, I decided to sell the project and move on.  I joined LiveAgent in 2013, and I was employee #10, the 1st and only marketing guy. I was 21 years old, not knowing what I was getting into but I experimented a lot and over the course of 4 years, I’ve helped the company grow from $20k to $250k in Monthly Recurring Revenue. ‍",1,0
128," It was my first take on entrepreneurship. I was so excited to jump in and start building it that I didn’t validate if the market needed it. Just wanted to scratch my own itch.  My main problem was, as I discovered, I was spending 50% of my time trying to figure out what tools to use to make something. It’s exciting we can create working web applications and marketplaces without writing code. I just wanted to make that process easier so people can spend less time trying to figure out what tool to use, and more time talking with users and customers to make something they love and need. ‍",0,0
129," I had a very typical middle-class upbringing, which prepared me to always follow the path of least resistance. By the 6th grade, I knew I’d be going to Oregon State University and studying business. 6 months before graduating, I had a job lined up as a portfolio analyst for a small investment firm. It was always just taking the easy road. Two things happened that changed that. 1) I started my desk job and realized it wasn’t anything like I imagined it being. The novelty of wearing a suit only lasts for so long.  2) I started in July of 2007 - which was at the peak of the stock market. By February 2009, the market had crashed. My boss was unhappy, our clients were unhappy, and I was unhappy. I needed a restart. I saved up all of my vacation time for the year to go to Carnival with my best friend Ryan in Rio. We spent two weeks hang-gliding over Rio, dancing in the Carnival parade, and even visiting Iguazu Falls, one of the seven natural wonders of the world. On the last day, we were sitting on Ipanema Beach, thinking “we should be able to do this whenever we want.” The day I got back I received a 20% pay cut. That was when I knew a change needed to come, and within two months I’d launched Location Rebel simply as a vehicle for change for myself, and to hold myself publicly accountable for all the things I wanted to do in life. I had two goals when I graduated college: Travel and own my own business. I wasn’t getting closer to any of those in my job, and this was the tipping point that encouraged me to pursue both. The first thing I did on the site was publish my bucket list. 100 things I wanted to do before I died. I started checking them off, and people started paying attention. I think the brutal honesty of where I was at in life, coupled with an attitude of “if Sean can make a big change, maybe I can too” is what initially helped to get some traction. ",1,0
130," Lockpick Entertainment was the first startup I ever worked with. It was a small game studio started by students at my school. Basically, some students figured out that the best way to get some experience was to start their own company. They did, and I joined them a year after that. We created a hybrid MMO RTS game called Dreamlords where thousands of players would play against each other and a rapidly collapsing world to level up their avatars in iterations of the apocalypse. Eventually to break the cycle (never happened though). ‍",0,0
131," In 2019, during our digital nomad stint, we’ve launched a newsletters network called Unreadit. It received a warm welcome online, great testimonials, and has been growing steadily since launch. Basically, we’ve created different newsletters with the best content on many topics, sourcing from Reddit. Initially, they were all manually curated, while now we’ve automated most of them, and just edit the most popular ones. It started generating revenue from sponsorship, but it’s really unpredictable: some months $0, others $1000. We also felt like it was time to take it to the next level and let users craft their own newsletters. That’s when we realized that this is something that could provide real value to people, and we wanted it ourselves: an app to create beautiful automated newsletters on any topic. So we started working on Mailbrew. Initially, it lets you create newsletters mixing any subreddit and RSS Feed, and offering few customizations. During the private beta, we added many features and possible customizations, and new sources like Twitter, Hacker News and YouTube. What started as a “tool to create automated newsletters” slowly became much more ambitious. A way to truly unplug from feeds, keep in touch with things and people you care about, and really be on top of your game by getting essential information on any topic, every day or week.",1,0
132," I’m not a perfectionist. My aim is to launch a fully-functional prototype and collect feedback from real users. That’s exactly what happened with KWFinder. I shared it on Reddit and the feedback was awesome. At that time, I didn’t think about Mangools, a brand that would cover more SEO tools. I had many different projects before Mangools. They included web development, affiliate websites, e-shops, domaining, and SaaS businesses. SaaS is a business field that truly attracts my attention. It gives me enough space to be creative and focused on the development of my own product. Before KWFinder, I developed some online marketing tools to cover my needs. I kind of hoped there would be more people with the same needs. I’m not a fan of deep analyses and business plans so I always use my intuition to evaluate the market potential. Why did these projects fail? Well, sometimes I lost the enthusiasm to finish them. In other cases, I missed the good old product-market fit. The competition on global markets is enormous so coming up with an idea that hits the market at the right time while customers are willing to pay for it is like looking for a needle in a haystack.",1,0
133," Before ManyRequests, I built two other companies. During my law studies, I started an apartment rental service for international students and expats. After that, I co-founded a design outsourcing service that is still going strong with a university friend. I have always had a passion for entrepreneurship. Starting and growing something from scratch gives me immense satisfaction.  The idea from ManyRequests came during my last business. Back then, we managed 30 designers and hundreds of clients, and the project management or help desk software available was not suited for that type of business. In addition, around 2018, I started relating my entrepreneurial journey online, mainly through a Facebook group called Productize.Community where I matched other service-based entrepreneurs. The combination of scratching my own itch and connecting with other entrepreneurs who experienced the same problem made me decide to start ManyRequests. ‍",1,0
134," I was focused on my consulting business before I met Aki Balogh, President & MarketMuse co-founder. I focused on SEO and content strategies to help clients solve technical problems and gain an advantage in search engine results. Previously I led the Traffic, Search, and Engagement team for seven years at TechTarget, a leader in B2B technology publishing and lead generation. I helped Aki drive the direction of MarketMuse based on my experience in the search field. I was responsible for the SEO strategy for dozens of websites at TechTarget. It takes hours to do the keyword, competitive, and link research required for a single article, no less for an entire network. I saw the potential in MarketMuse immediately around creating a single place for someone to automatically audit their site, identify gaps, seek opportunities and scale high-quality output -- and that’s what MarketMuse does today. We’re excited to get deeper into AI-generated content. We’ve been building and honing our model for a few years and believe this will be a game-changer for scaling content. It won’t replace writers, but instead, it will augment their process, especially for the less creative content types. Imagine writing descriptive product material for an entire catalog in a matter of hours instead of weeks writing by hand. The use cases for this industry are truly game-changing. ",1,0
135," When I think of how I came to be involved in Matboard and More, there are three important parts of my life that came together to make it happen. One, I got my first job as an engineer designing traffic control devices. I was actually really passionate about traffic... because I hated it! I hated the powerlessness of sitting in front of a green light and still not being able to move because of the thousands of cars ahead of me. Traffic to me is a symbol of how screwed up our society is. How willing we are to waste hours a day commuting to places we don’t like. It’s become an accepted part of life, sitting in traffic, but I couldn’t do it. I would get stressed out of my mind thinking… waste of time, waste of energy, stupid… so I got a job in traffic thinking if I was working towards solving the problem it would make things easier. It did for a short time but then I realized this problem was going to be solved with self-driving cars and nothing else. My bigger realization through working as an engineer was that I hated not having control. I couldn’t control my schedule, what I worked on, who I worked with and most importantly when I could take my damned vacations! So, I realized that my personality is simply incompatible with working the standard job, and I needed to find work that gave me freedom. This became crystal clear to me in 2010 and I spent the rest of my life ensuring I would one day achieve my goal of controlling my own life. Two, I didn’t really have a clear idea of what I needed to do in order to gain that freedom and control in my life but I figured quitting my job and getting an MBA was a good start. The next two years I spent a lot of time reinventing myself from a nerdy engineer with limited social skills into a pretty cool guy who was not afraid to ask life for more. I can say that I didn’t learn a tone academically in my MBA but I gained the confidence to know I could be successful at whatever I put my mind to. I wrote a blog about this at the time. Third, circumstances came together perfectly when my brother and brother-in-law came to with me this awesome idea. I can’t take credit for the idea or the initial startup phase, I got involved as the site was getting ready to launch. You can’t underestimate the power of having a good team. Now since this is Failory, I should mention that during my MBA I specialized in Organizational Behavior and was looking to get into HR Consulting. For the life of me though I couldn’t get an interview, save for one with P&G. I guess I did terribly because they didn’t take me past the phone interview. I was actually devastated at this point because it was about 4 months on the job hunt (with loads of MBA debt) without any leads before Matboard and More came into the picture. So, to summarize, my drive for control and freedom, my transformation during my MBA and great partners were what made Matboard and More possible for me.  ",1,0
